[
  {"type":"turn/start","seq":1,"time":1000,"data":{"turn":1}},
  {"type":"step/start","seq":2,"time":1001,"data":{"turn":1,"step":1}},
  {"type":"user/message","seq":3,"time":1002,"data":{"turn":1,"step":1,"id":"fixture-user-1","role":"user","content":[{"type":"text","text":"inspect"}],"source":{"kind":"user"}},"surfaceOp":"append"},
  {"type":"request/header","seq":4,"time":1003,"data":{"turn":1,"step":1,"header":{"config":{"provider":"fixture","model":"fixture-model"},"system":"fixture"},"reason":"initial"}},
  {"type":"assistant/chunk","seq":5,"time":1004,"data":{"turn":1,"step":1,"chunk":{"type":"text-delta","index":0,"text":"I will inspect."}}},
  {"type":"assistant/message","seq":6,"time":1005,"data":{"turn":1,"step":1,"message":{"id":"fixture-assistant-1","role":"assistant","content":[{"type":"text","text":"I will inspect."}],"source":{"kind":"model","provider":"fixture","model":"fixture-model"}}},"surfaceOp":"append"},
  {"type":"tool/call","seq":7,"time":1006,"data":{"turn":1,"step":1,"callId":"call-fixture","name":"read","arguments":"{\"path\":\"README.md\"}"}},
  {"type":"tool/result","seq":8,"time":1007,"data":{"turn":1,"step":1,"message":{"id":"fixture-tool-1","role":"user","content":[{"type":"tool-result","toolCallId":"call-fixture","content":[{"type":"text","text":"fixture output"}],"isError":false}],"source":{"kind":"tool","callId":"call-fixture"}}},"surfaceOp":"append","sourceEventSeqs":[7]},
  {"type":"step/end","seq":9,"time":1008,"data":{"turn":1,"step":1}},
  {"type":"turn/end","seq":10,"time":1009,"data":{"turn":1,"reason":{"kind":"completed"}}}
]
